{"buildID":"packaging-test-1","interfaceVersion":1,"kind":"build","options":{"deadlineMilliseconds":60000},"source":{"filename":"Sketch.ino","revision":"document-1:revision-7","text":"void setup() {}\nvoid loop() {}"},"target":{"board":"nano_rp2040_connect","firmwareBuild":{"apiAddress":268571980,"backend":"application","board":"nano_rp2040_connect","buildReportSHA256":"2222222222222222222222222222222222222222222222222222222222222222","firmwareCommit":"f17fdf0301256ba48270230cbf213126e70aa8d0","firmwareImageSHA256":"1111111111111111111111111111111111111111111111111111111111111111","firmwareVersion":"0.1.0-m9exp1","maximumCapsuleBytes":4096,"profile":"nano-managed-v1","qualification":"experimental","recipeIdentifier":"nano-stateless-clang-22.1.8-v1-experimental","recipeSHA256":"b7869f6fc863e1905deb6974408c6e7dc63943a1fb3e342a357fdf757b1e23d9","residentABI":1,"residentELFSHA256":"2222222222222222222222222222222222222222222222222222222222222222","schema":1,"targetID":1},"profile":"nano-managed-v1","recipeIdentifier":"nano-stateless-clang-22.1.8-v1-experimental","recipeSHA256":"b7869f6fc863e1905deb6974408c6e7dc63943a1fb3e342a357fdf757b1e23d9"}}
